{
  "contractVersion": "v1alpha1",
  "issuer": "robothree.central.fixture",
  "audience": "robothree.enterprise-gateway",
  "enterpriseId": "enterprise.fixture",
  "userId": "user.fixture",
  "deviceId": "device.fixture-001",
  "clientInstanceId": "11111111-1111-4111-8111-111111111111",
  "tokenId": "55555555-5555-4555-8555-555555555555",
  "issuedAt": "2026-07-24T18:00:05+08:00",
  "expiresAt": "2026-07-24T18:15:05+08:00",
  "permissions": [
    "configuration.read",
    "model.use",
    "tool.use",
    "agent.use",
    "skill.use",
    "knowledge.use"
  ]
}
